{
  "schema_version": "2.0.0",
  "snapshot": {
    "project_id": "motion://project/motion-os",
    "main_sha": "a8d7dbddaeb4ad9779df9883d3cf4e4f6ea4f29d",
    "session_id": "motion://session/chatgpt/graph-refactor-v2/20260829T234000+0200",
    "workstream_id": "motion://workstream/graph-refactor-v2",
    "correlation_id": "graph-refactor-v2-001",
    "generated_at": "2026-08-29T23:48:00+02:00",
    "bootstrap_event_watermark": "github-issue-39@comment-5465052885",
    "runtime_event_watermark": null,
    "contextpack_revision": null,
    "authority": "IMPLEMENTED"
  },
  "nodes": [
    {"id":"motion://project/motion-os","type":"Project","label":"MOTION.OS","authority":"VERIFIED","confidence":"HIGH_CONFIDENCE","state":"ACTIVE","owner":"motion://agent/owner/rotprods","valid_from":null,"valid_to":null,"attributes":{"north_star":"Brief in → professional motion-design master out"},"provenance":["GOAL.md@main","AGENTS.md@main"]},
    {"id":"motion://northstar/professional-motion-master","type":"NorthStar","label":"Brief → professional motion master","authority":"VERIFIED","confidence":"HIGH_CONFIDENCE","state":"ACTIVE","owner":null,"valid_from":null,"valid_to":null,"attributes":{"creative_quality_weight":0.45,"trust_evidence_weight":0.20,"autonomy_weight":0.20,"engineering_quality_weight":0.15},"provenance":["GOAL.md@main","Issue#48 product delta"]},
    {"id":"motion://repository/rotprods-motion-os","type":"Repository","label":"rotprods/motion-OS","authority":"VERIFIED","confidence":"HIGH_CONFIDENCE","state":"ACTIVE","owner":"motion://agent/owner/rotprods","valid_from":null,"valid_to":null,"attributes":{"default_branch":"main","main_protected":false},"provenance":["GitHub live main"]},
    {"id":"motion://commit/a8d7dbd","type":"Commit","label":"main@a8d7dbd","authority":"VERIFIED","confidence":"HIGH_CONFIDENCE","state":"CURRENT_MAIN","owner":null,"valid_from":"2026-08-27T15:15:28+02:00","valid_to":null,"attributes":{"sha":"a8d7dbddaeb4ad9779df9883d3cf4e4f6ea4f29d"},"provenance":["GitHub live branch main"]},
    {"id":"motion://barrier/issue-48","type":"Barrier","label":"Historical regression / cognitive pause","authority":"VERIFIED","confidence":"HIGH_CONFIDENCE","state":"OPEN","owner":null,"valid_from":null,"valid_to":null,"attributes":{"issue":48,"release_observed":false},"provenance":["Issue#48 live","Issue#39 latest checkpoints"]},
    {"id":"motion://bus/bootstrap-39","type":"EventBusSurface","label":"GitHub Issue #39 bootstrap bus","authority":"VERIFIED","confidence":"HIGH_CONFIDENCE","state":"ACTIVE_BOOTSTRAP","owner":null,"valid_from":null,"valid_to":null,"attributes":{"issue":39,"truth_role":"delivery/bootstrap surface"},"provenance":["Issue#39 live"]},
    {"id":"motion://eventstore/runtime-v3","type":"EventStore","label":"Phase07 Runtime EventStore v3 candidate","authority":"VERIFIED","confidence":"HIGH_CONFIDENCE","state":"BRANCH_HEAD_NOT_PROMOTED","owner":"motion://workstream/event-fabric-v3","valid_from":null,"valid_to":null,"attributes":{"pr":58,"multi_host_authority":false},"provenance":["PR#58 live"]},
    {"id":"motion://projection/state-md","type":"Projection","label":"STATE.md current-state projection","authority":"IMPLEMENTED","confidence":"LOW_CONFIDENCE","state":"STALE_CONTRADICTORY","owner":null,"valid_from":null,"valid_to":null,"attributes":{"claims_candidate":"RC09E","claims_remotion_p0":true},"provenance":["STATE.md@main"]},
    {"id":"motion://projection/project-state-json","type":"Projection","label":"state/project_state.json","authority":"IMPLEMENTED","confidence":"LOW_CONFIDENCE","state":"STALE_CONTRADICTORY","owner":null,"valid_from":null,"valid_to":null,"attributes":{"canonical_version":"v0.9.1-rc06-working","candidate":"RC07","remotion_verified":true},"provenance":["state/project_state.json@main"]},
    {"id":"motion://projection/handoff-md","type":"Projection","label":"HANDOFF.md","authority":"IMPLEMENTED","confidence":"LOW_CONFIDENCE","state":"STALE_CONTRADICTORY","owner":null,"valid_from":null,"valid_to":null,"attributes":{"working_master":"RC06","claims_remotion_unverified":true},"provenance":["HANDOFF.md@main"]},
    {"id":"motion://projection/tasks-md","type":"Projection","label":"TASKS.md","authority":"IMPLEMENTED","confidence":"MEDIUM_CONFIDENCE","state":"PARTIALLY_STALE","owner":null,"valid_from":null,"valid_to":null,"attributes":{"remotion_p0_open":true,"hyperframes_p0_open":true},"provenance":["TASKS.md@main"]},
    {"id":"motion://defect/truth-split-brain","type":"ArchitectureDefect","label":"Current-state split brain","authority":"VERIFIED","confidence":"HIGH_CONFIDENCE","state":"P0_OPEN","owner":"motion://workstream/canonical-truth","valid_from":null,"valid_to":null,"attributes":{"severity":"P0","blast_radius":"agent bootstrap, release authority, product prioritization","trigger":"PR #56 / canonical projector convergence","resolution_path":"compile one machine current-state projection from live lifecycle + canonical event/evidence authority, then generate/validate STATE/TASKS/HANDOFF views and fail CI on contradiction"},"provenance":["Issue#48","STATE.md@main","project_state.json@main","HANDOFF.md@main","PR#56"]},
    {"id":"motion://capability/remotion","type":"Capability","label":"Remotion production runtime","authority":"VERIFIED","confidence":"HIGH_CONFIDENCE","state":"MERGED_RUNTIME_VERIFIED","owner":null,"valid_from":null,"valid_to":null,"attributes":{"source_pr":42},"provenance":["coordination/ACTIVE_AGENTS.yaml@main","Issue#48"]},
    {"id":"motion://capability/hyperframes","type":"Capability","label":"HyperFrames production runtime","authority":"IMPLEMENTED","confidence":"HIGH_CONFIDENCE","state":"PHYSICAL_RUNTIME_PR_OPEN","owner":"motion://workstream/hyperframes-runtime","valid_from":null,"valid_to":null,"attributes":{"pr":62},"provenance":["PR#62 live"]},
    {"id":"motion://capability/lottie","type":"Capability","label":"Lottie supported-subset runtime","authority":"IMPLEMENTED","confidence":"HIGH_CONFIDENCE","state":"PHYSICAL_PLAYER_BLOCKED_BY_CI_AUTHORITY","owner":"motion://workstream/lottie-runtime","valid_from":null,"valid_to":null,"attributes":{"pr":66},"provenance":["PR#66 live"]},
    {"id":"motion://capability/temporal-critic","type":"Capability","label":"Full-video temporal multimodal critic","authority":"IMPLEMENTED","confidence":"HIGH_CONFIDENCE","state":"PROVIDER_UNQUALIFIED","owner":"motion://workstream/temporal-critic","valid_from":null,"valid_to":null,"attributes":{"pr":65},"provenance":["PR#65 live"]},
    {"id":"motion://artifact/rc09e","type":"Artifact","label":"RC09E physical master","authority":"BLOCKED","confidence":"HIGH_CONFIDENCE","state":"PHYSICAL_MEDIA_NOT_RECOVERABLE_FROM_GITHUB","owner":null,"valid_from":null,"valid_to":null,"attributes":{"expected_resolution":"1080x1920","expected_fps":30,"expected_duration_s":10.0},"provenance":["STATE.md@main","Issue#39 temporal critic handoff"]},
    {"id":"motion://artifact/rc06","type":"Artifact","label":"RC06 registered rollback master","authority":"VERIFIED","confidence":"HIGH_CONFIDENCE","state":"ROLLBACK_REGISTERED","owner":null,"valid_from":null,"valid_to":null,"attributes":{},"provenance":["Issue#48 product delta","HANDOFF.md@main"]},
    {"id":"motion://metric/product-score","type":"Metric","label":"Product North-Star score","authority":"VERIFIED","confidence":"HIGH_CONFIDENCE","state":"ACTIVE","owner":null,"valid_from":null,"valid_to":null,"attributes":{"creative_quality":0.45,"trust_evidence":0.20,"autonomy":0.20,"engineering_quality":0.15},"provenance":["Issue#48 product delta"]},
    {"id":"motion://metric/regression-risk-score","type":"Metric","label":"Regression promotion risk score","authority":"VERIFIED","confidence":"HIGH_CONFIDENCE","state":"ACTIVE","owner":null,"valid_from":null,"valid_to":null,"attributes":{"purpose":"promotion safety only"},"provenance":["Issue#48"]},
    {"id":"motion://invariant/frame-duration","type":"Invariant","label":"frame_count/fps is visual duration authority","authority":"VERIFIED","confidence":"HIGH_CONFIDENCE","state":"PERMANENT","owner":null,"valid_from":null,"valid_to":null,"attributes":{},"provenance":["historical regression corpus","PR#55"]},
    {"id":"motion://invariant/fencing-monotonic","type":"Invariant","label":"Fencing generations monotonic forever","authority":"VERIFIED","confidence":"HIGH_CONFIDENCE","state":"PERMANENT","owner":null,"valid_from":null,"valid_to":null,"attributes":{},"provenance":["Issue#48 historical escaped bugs"]},
    {"id":"motion://invariant/schema-format","type":"Invariant","label":"JSON Schema format requires real FormatChecker","authority":"VERIFIED","confidence":"HIGH_CONFIDENCE","state":"PERMANENT","owner":null,"valid_from":null,"valid_to":null,"attributes":{},"provenance":["Issue#48 historical escaped bugs"]},
    {"id":"motion://invariant/reconcile-before-retry","type":"Invariant","label":"Provider timeout after acceptance requires reconcile before retry","authority":"VERIFIED","confidence":"HIGH_CONFIDENCE","state":"PERMANENT","owner":null,"valid_from":null,"valid_to":null,"attributes":{},"provenance":["Issue#48","src/avatar/render_guard.py@main"]},
    {"id":"motion://invariant/combined-head","type":"Invariant","label":"Main advancement invalidates prior CI authority","authority":"VERIFIED","confidence":"HIGH_CONFIDENCE","state":"PERMANENT","owner":null,"valid_from":null,"valid_to":null,"attributes":{},"provenance":["Issue#48 historical escaped bugs"]},
    {"id":"motion://invariant/tts-semantic","type":"Invariant","label":"TTS preserves numeric/name/claim semantics, not digits only","authority":"VERIFIED","confidence":"HIGH_CONFIDENCE","state":"BRANCH_HEAD_NOT_PROMOTED","owner":"motion://workstream/tts-semantic-integrity","valid_from":null,"valid_to":null,"attributes":{"pr":71},"provenance":["PR#71 live"]},